{
  "$schema": "../../schema/mod.schema.json",
  "name": "terminal-gym",
  "title": "Terminal Gym",
  "tagline": "A daily rep goal above the prompt: log sets with +5/+10/+25 and keep a streak while Claude works.",
  "tagline_ru": "Дневная норма повторений над полем ввода: отмечайте подходы кнопками +5/+10/+25 и держите серию дней.",
  "description": "A daily bodyweight rep goal inside Claude Code. A band above the prompt shows today's exercise as a ▓░ bar (grey at 0, then red, yellow and green), the pace (next set or how far behind), +5/+10/+25 buttons and a 🔥 streak. The goal is spread into sets over 8 hours from your first prompt, with a toast as each set comes due. In easy mode (the default) a turn past 30 seconds raises a toast and puts the suggested set in the spinner; strict mode instead holds typed prompts while you are behind. `/fit 20` logs reps, `/fit program` picks a program, `/fit score` opens a scoreboard with a barbell, a 28-day grid and the last week. Data stays in `~/.claude/fitness`; no network calls.",
  "description_ru": "Дневная норма упражнений с собственным весом прямо в Claude Code. Полоса над полем ввода показывает упражнение дня шкалой ▓░ (серой при нуле, затем красной, жёлтой и зелёной), темп (время следующего подхода или отставание), кнопки +5/+10/+25 и серию 🔥. Подходы распределяются по 8 часам с первого запроса за день, и о каждом напоминает уведомление. В мягком режиме (по умолчанию) ход дольше 30 секунд вызывает уведомление, а спиннер предлагает подход; строгий режим вместо этого задерживает набранные запросы, пока вы отстаёте. `/fit 20` записывает повторения, `/fit program` выбирает программу, `/fit score` открывает табло со штангой, сеткой за 28 дней и последней неделей. Данные хранятся в `~/.claude/fitness`, сетевых запросов нет.",
  "author": { "name": "Naitik Mehta", "github": "DrumAndCode", "url": "https://github.com/DrumAndCode" },
  "maintainers": ["DrumAndCode"],
  "category": "fun",
  "tags": ["fitness", "habit", "streak", "band", "strict-mode", "toast"],
  "license": "MIT",
  "version": "0.1.3",
  "homepage": "https://github.com/DrumAndCode/terminal-gym",
  "source": { "type": "marketplace", "marketplace": "DrumAndCode/terminal-gym", "plugin": "terminal-gym" },
  "surfaces": ["terminal", "desktop"],
  "requires": { "claudeCode": ">=2.1.288" },
  "capabilities": {
    "network": false,
    "processes": false,
    "filesystem": "write",
    "model": false,
    "promptRewrite": true,
    "blocksTools": false
  },
  "preview": {
    "surface": "terminal",
    "scene": "coding",
    "caption": "Easy mode on a long turn: 60/100 pushups on pace with a 3-day streak, the set in the spinner and a toast; /fit score opens the scoreboard.",
    "caption_ru": "Мягкий режим на долгом ходе: 60/100 отжиманий по графику и серия 3 дня, подход в спиннере и уведомление; /fit score открывает табло.",
    "elements": [
      {
        "slot": "above-prompt",
        "rows": [
          [
            { "text": "💪 ▓▓▓▓▓▓░░░░ 60/100 pushups  next set 14:20  ", "color": "#d7af5f" },
            { "text": "log reps: ", "dim": true },
            { "button": "+5" },
            " ",
            { "button": "+10" },
            " ",
            { "button": "+25" },
            "  🔥3d"
          ]
        ]
      },
      { "slot": "spinner", "verb": "10 pushups while Claude works" },
      { "slot": "toast", "text": "Your agent's mid-set. You next: 10 pushups." },
      { "slot": "command", "command": "/fit", "args": "10", "output": [["💪 ▓▓▓▓▓▓░░░░ 60/100 pushups  next set 14:20"]] },
      { "slot": "command", "command": "/fit", "args": "score", "output": [["🔥 3-day streak · Esc or /fit score to close"]] },
      {
        "slot": "pane",
        "title": "TERMINAL GYM",
        "rows": [
          [{ "text": " ▐█▌▐█▌                    ▐█▌▐█▌ ", "color": "#d7af5f" }],
          [{ "text": "━▐█▌▐█▌━━━ ", "color": "#d7af5f" }, { "text": "TERMINAL GYM", "bold": true }, { "text": " ━━━▐█▌▐█▌━", "color": "#d7af5f" }],
          [{ "text": " ▐█▌▐█▌                    ▐█▌▐█▌ ", "color": "#d7af5f" }],
          [" "],
          [{ "text": "🔥 3-day streak", "bold": true }],
          [{ "text": "💪 ▓▓▓▓▓▓░░░░ 60/100 pushups", "dim": true }],
          [" "],
          [{ "text": "last 28 days · ▒ today", "dim": true }],
          [
            { "text": "██ ", "color": "#c8a86b" },
            { "text": "██ ", "color": "#c8a86b" },
            { "text": "██ ", "color": "#c8a86b" },
            { "text": "██ ", "color": "#6b5d3f" },
            { "text": "██ ", "color": "#c8a86b" },
            { "text": "██ ", "color": "#343434" },
            { "text": "██", "color": "#c8a86b" }
          ],
          [
            { "text": "██ ", "color": "#c8a86b" },
            { "text": "██ ", "color": "#c8a86b" },
            { "text": "██ ", "color": "#c8a86b" },
            { "text": "██ ", "color": "#c8a86b" },
            { "text": "██ ", "color": "#6b5d3f" },
            { "text": "██ ", "color": "#c8a86b" },
            { "text": "██", "color": "#c8a86b" }
          ],
          [
            { "text": "██ ", "color": "#343434" },
            { "text": "██ ", "color": "#c8a86b" },
            { "text": "██ ", "color": "#c8a86b" },
            { "text": "██ ", "color": "#c8a86b" },
            { "text": "██ ", "color": "#c8a86b" },
            { "text": "██ ", "color": "#c8a86b" },
            { "text": "██", "color": "#6b5d3f" }
          ],
          [
            { "text": "██ ", "color": "#c8a86b" },
            { "text": "██ ", "color": "#c8a86b" },
            { "text": "██ ", "color": "#6b5d3f" },
            { "text": "██ ", "color": "#c8a86b" },
            { "text": "██ ", "color": "#c8a86b" },
            { "text": "██ ", "color": "#c8a86b" },
            { "text": "▒▒", "color": "#6b5d3f" }
          ],
          [" "],
          [{ "text": "✓ 10-09  100/100  dips", "dim": true }],
          [{ "text": "✓ 10-10  300/300  squats", "dim": true }],
          [{ "text": "· 10-11  40/100   pushups", "dim": true }],
          [{ "text": "✓ 10-12  100/100  pushups", "dim": true }],
          [{ "text": "✓ 10-13  100/100  dips", "dim": true }],
          [{ "text": "✓ 10-14  300/300  squats", "dim": true }],
          [{ "text": "· 10-15  60/100   pushups  ◀ today", "bold": true }],
          [" "],
          [{ "text": "Esc or /fit score to close", "dim": true }],
          [{ "button": "Close" }]
        ]
      },
      { "slot": "toast", "text": "⏱ Set due: 10 pushups. 70/100 by now." },
      { "slot": "background", "text": "Strict mode holds typed prompts when behind, refills the box: Behind pace: 10 pushups to catch up (70/100 due by now). /fit 10 to log. /fit rest skips the day (breaks streak)." }
    ]
  },
  "media": [
    {
      "type": "image",
      "src": "https://raw.githubusercontent.com/DrumAndCode/terminal-gym/main/docs/band.png",
      "alt": "The Terminal Gym band above the Claude Code prompt: 0/100 pushups, behind 10, with +5, +10 and +25 buttons",
      "surface": "terminal"
    }
  ]
}
